Name	Type	References	Description
rolname	name	 	Role name
rolsuper	bool	 	Role has superuser privileges
rolinherit	bool	 	Role automatically inherits privileges of roles it is\n a member of
rolcreaterole	bool	 	Role can create more roles
rolcreatedb	bool	 	Role can create databases
rolcatupdate	bool	 	Role can update system catalogs directly. (Even a\n superuser cannot do this unless this column is true)
rolcanlogin	bool	 	Role can log in. That is, this role can be given as\n the initial session authorization identifier
rolconnlimit	int4	 	For roles that can log in, this sets maximum number\n of concurrent connections this role can make. -1 means no limit.
rolpassword	text	 	Not the password (always reads as ********)
rolvaliduntil	timestamptz	 	Password expiry time (only used for password\n authentication); null if no expiration
rolconfig	text[]	 	Role-specific defaults for run-time configuration\n variables
oid	oid	pg_authid.oid	ID of role