name	text	true		"name of the memory contex"
ident	text	true		"identification information of the memory context. this field is truncated at 1024 byte"
parent	text	true		"name of the parent of this memory contex"
level	int4	true		"distance from topmemorycontext in context tre"
total_bytes	int8	true		"total bytes allocated for this memory contex"
total_nblocks	int8	true		"total number of blocks allocated for this memory contex"
free_bytes	int8	true		"free space in byte"
free_chunks	int8	true		"total number of free chunk"
used_bytes	int8	true		"used space in byte"
