Index	Name	Type	Nullable	References	Description
1	stxoid	oid	false		"extended statistics object containing the definition for this data"
2	stxdndistinct	pg_ndistinct	true		"n-distinct counts, serialized as pg_ndistinct type"
3	stxddependencies	pg_dependencies	true		"functional dependency statistics, serialized as pg_dependencies type"
4	stxdmcv	pg_mcv_list	true		"mcv (most-common values) list statistics, serialized as pg_mcv_list type"
5	stxdexpr	pg_statistic[]	true		"per-expression statistics, serialized as an array of pg_statistic type"
