Index	Name	Type	Nullable	References	Description
1	name	text			"the identifier of the prepared statement"
2	statement	text			"the query string submitted by the client to create this prepared statement. for prepared statements created via sql, this is the prepare statement submitted by the client. for prepared statements created via the frontend/backend protocol, this is the text of the prepared statement itself."
3	prepare_time	timestamptz			"the time at which the prepared statement was created"
4	parameter_types	regtype[]			"the expected parameter types for the prepared statement in the form of an array of regtype. the oid corresponding to an element of this array can be obtained by casting the regtype value to oid."
5	result_types	regtype[]			"the types of the columns returned by the prepared statement in the form of an array of regtype. the oid corresponding to an element of this array can be obtained by casting the regtype value to oid. if the prepared statement does not provide a result (e.g., a dml statement), then this field will be null."
6	from_sql	bool			"true if the prepared statement was created via the prepare sql command; false if the statement was prepared via the frontend/backend protocol"
7	generic_plans	int8			"number of times generic plan was chosen"
8	custom_plans	int8			"number of times custom plan was chosen"
