Name	Type	References	Description
rulename	name		"rule name"
ev_class	oid	pg_class.oid	"the table this rule is for"
ev_attr	int2		"the column this rule is for (currently, always zero to indicate the whole table)"
ev_type	char		"event type that the rule is for: '1' = select, '2' = update, '3' = insert, '4' = delete"
is_instead	bool		"true if the rule is an instead rule"
ev_qual	text		"expression tree (in the form of a nodetostring representation) for the rule's qualifying condition"
ev_action	text		"query tree (in the form of a nodetostring representation) for the rule's action"
