Index	Name	Type	References	Description
0	name	NAME			"extension name"
1	version	TEXT			"version name"
2	installed	BOOL			"true if this version of this extension is currently installed"
3	superuser	BOOL			"true if only superusers are allowed to install this extension"
4	relocatable	BOOL			"true if extension can be relocated to another schema"
5	schema	NAME			"name of the schema that the extension must be installed into, or null if partially or fully relocatable"
6	requires	NAME[]			"names of prerequisite extensions, or null if none"
7	comment	TEXT			"comment string from the extension's control file"
