Index	Name	Type	Nullable	References	Description
1	oid	oid			"row identifier (hidden attribute; must be explicitly selected)"
2	conname	name			"conversion name (unique within a namespace)"
3	connamespace	oid		pg_namespace.oid	"the oid of the namespace that contains this conversion"
4	conowner	oid		pg_authid.oid	"owner of the conversion"
5	conforencoding	int4			"source encoding id"
6	contoencoding	int4			"destination encoding id"
7	conproc	regproc		pg_proc.oid	"conversion function"
8	condefault	bool			"true if this is the default conversion"
