Index	Name	Type	Nullable	References	Description
1	slot_name	name	true		"a unique, cluster-wide identifier for the replication slot"
2	plugin	name	true		"the base name of the shared object containing the output plugin this logical slot is using, or null for physical slots."
3	slot_type	text	true		"the slot type - physical or logical"
4	datoid	oid	true		"the oid of the database this slot is associated with, or null. only logical slots have an associated database."
5	database	name	true		"the name of the database this slot is associated with, or null. only logical slots have an associated database."
6	active	bool	true		"true if this slot is currently actively being used"
7	xmin	xid	true		"the oldest transaction that this slot needs the database to retain. vacuum cannot remove tuples deleted by any later transaction."
8	catalog_xmin	xid	true		"the oldest transaction affecting the system catalogs that this slot needs the database to retain. vacuum cannot remove catalog tuples deleted by any later transaction."
9	restart_lsn	pg_lsn	true		"the address (lsn) of oldest wal which still might be required by the consumer of this slot and thus won't be automatically removed during checkpoints."
