Name	Type	References	Description
objoid	oid		"the oid of the object this security label pertains to"
classoid	oid		"the oid of the system catalog this object appears in"
objsubid	int4		"for a security label on a table column, this is the column number (the objoid and classoid refer to the table itself). for all other object types, this column is zero."
objtype	text		"the type of object to which this label applies, as text."
objnamespace	oid		"the oid of the namespace for this object, if applicable; otherwise null."
objname	text		"the name of the object to which this label applies, as text."
provider	text		"the label provider associated with this label."
label	text		"the security label applied to this object."
