Name	Type	Nullable	References	Description
objoid	oid	true		"the oid of the object this security label pertains to"
classoid	oid	true		"the oid of the system catalog this object appears in"
objsubid	int4	true		"for a security label on a table column, this is the column number (the objoid and classoid refer to the table itself). for all other object types, this column is zero."
objtype	text	true		"the type of object to which this label applies, as text."
objnamespace	oid	true		"the oid of the namespace for this object, if applicable; otherwise null."
objname	text	true		"the name of the object to which this label applies, as text."
provider	text	true		"the label provider associated with this label."
label	text	true		"the security label applied to this object."
