0	oid	OID			"row identifier"
1	conname	NAME			"conversion name (unique within a namespace)"
2	connamespace	OID			"the oid of the namespace that contains this conversion"
3	conowner	OID			"owner of the conversion"
4	conforencoding	INT4			"source encoding id (pg_encoding_to_char() can translate this number to the encoding name)"
5	contoencoding	INT4			"destination encoding id (pg_encoding_to_char() can translate this number to the encoding name)"
6	conproc	REGPROC			"conversion function"
7	condefault	BOOL			"true if this is the default conversion"
