Index	Name	Type	Nullable	References	Description
0	oid	oid			"row identifier"
1	conname	name			"conversion name (unique within a namespace)"
2	connamespace	oid			"the oid of the namespace that contains this conversion"
3	conowner	oid			"owner of the conversion"
4	conforencoding	int4			"source encoding id (pg_encoding_to_char() can translate this number to the encoding name)"
5	contoencoding	int4			"destination encoding id (pg_encoding_to_char() can translate this number to the encoding name)"
6	conproc	regproc			"conversion function"
7	condefault	bool			"true if this is the default conversion"
