Name	Type	References	Description
name	text		The name of the cursor
statement	text		The verbatim query string submitted to declare this cursor
is_holdable	bool		true if the cursor is holdable (that is, it can be accessed after the transaction that declared the cursor has committed); false otherwise
is_binary	bool		true if the cursor was declared BINARY; false otherwise
is_scrollable	bool		true if the cursor is scrollable (that is, it allows rows to be retrieved in a nonsequential manner); false otherwise
creation_time	timestamptz		The time at which the cursor was declared