Index	Name	Type	Nullable	References	Description
1	oid	oid			"row identifier"
2	pubname	name			"name of the publication"
3	pubowner	oid		pg_authid.oid	"owner of the publication"
4	puballtables	bool			"if true, this publication automatically includes all tables in the database, including any that will be created in the future."
5	pubinsert	bool			"if true, insert operations are replicated for tables in the publication."
6	pubupdate	bool			"if true, update operations are replicated for tables in the publication."
7	pubdelete	bool			"if true, delete operations are replicated for tables in the publication."
8	pubtruncate	bool			"if true, truncate operations are replicated for tables in the publication."
