Index	Name	Type	Nullable	References	Description
1	rngtypid	oid			"oid of the range type"
2	rngsubtype	oid			"oid of the element type (subtype) of this range type"
3	rngcollation	oid			"oid of the collation used for range comparisons, or 0 if none"
4	rngsubopc	oid			"oid of the subtype's operator class used for range comparisons"
5	rngcanonical	regproc			"oid of the function to convert a range value into canonical form, or 0 if none"
6	rngsubdiff	regproc			"oid of the function to return the difference between two element values as double precision, or 0 if none"
