Index	Name	Type	Nullable	References	Description
0	oid	oid			"row identifier"
1	stxrelid	oid			"table containing the columns described by this object"
2	stxname	name			"name of the statistics object"
3	stxnamespace	oid			"the oid of the namespace that contains this statistics object"
4	stxowner	oid			"owner of the statistics object"
5	stxstattarget	int4			"stxstattarget controls the level of detail of statistics accumulated for this statistics object by analyze. a zero value indicates that no statistics should be collected. a negative value says to use the maximum of the statistics targets of the referenced columns, if set, or the system default statistics target. positive values of stxstattarget determine the target number of ""most common values"" to collect."
6	stxkeys	int2vector			"an array of attribute numbers, indicating which table columns are covered by this statistics object; for example a value of 1 3 would mean that the first and the third table columns are covered"
7	stxkind	char[]			"an array containing codes for the enabled statistics kinds; valid values are: d for n-distinct statistics, f for functional dependency statistics, and m for most common values (mcv) list statistics"
