Index	Name	Type	Nullable	References	Description
0	oid	oid			"row identifier"
1	prsname	name			"text search parser name"
2	prsnamespace	oid			"the oid of the namespace that contains this parser"
3	prsstart	regproc			"oid of the parser's startup function"
4	prstoken	regproc			"oid of the parser's next-token function"
5	prsend	regproc			"oid of the parser's shutdown function"
6	prsheadline	regproc			"oid of the parser's headline function"
7	prslextype	regproc			"oid of the parser's lextype function"
